{"$schema":"https://json-schema.org/draft/2020-12/schema","$id":"https://capital-decision-lab.invalid/schemas/portfolio-snapshot.v1.schema.json","type":"object","additionalProperties":false,"required":["contract_version","snapshot_id","capture_timestamp","cash","total_equity","margin_used","borrowed_amount","maintenance_margin_requirement","initial_margin_requirement","portfolio_source","positions","verification_status"],"properties":{"contract_version":{"const":"nhi.portfolio_snapshot.v1"},"snapshot_id":{"type":"string","minLength":1},"capture_timestamp":{"type":"string","minLength":1},"cash":{"type":"number"},"total_equity":{"type":"number"},"margin_used":{"type":"number"},"borrowed_amount":{"type":"number"},"maintenance_margin_requirement":{"type":"number"},"initial_margin_requirement":{"type":"number"},"portfolio_source":{"enum":["manual","csv","screenshot","broker_export","pasted_table","local_json"]},"positions":{"type":"array","minItems":1,"items":{"$ref":"#/$defs/position"}},"source_artifact_path":{"type":"string"},"source_artifact_hash":{"type":"string","pattern":"^[a-f0-9]{64}$"},"verification_status":{"enum":["auto_retrieved","user_verified","user_corrected","unverified_extraction","failed","unavailable"]}},"$defs":{"position":{"type":"object","additionalProperties":false,"required":["ticker","shares","current_price","market_value","position_weight","user_intent"],"properties":{"ticker":{"type":"string","minLength":1},"asset_name":{"type":"string"},"shares":{"type":"number"},"average_cost":{"type":"number"},"current_price":{"type":"number"},"market_value":{"type":"number"},"unrealized_gain_loss":{"type":"number"},"position_weight":{"type":"number"},"margin_requirement":{"type":"number"},"user_intent":{"enum":["buy","sell","hold","trim","add","hedge","watch"]},"max_position_cap":{"type":"number"},"notes":{"type":"string"}}}}}
