{"contract_version":"nhi.portfolio_snapshot.v1","snapshot_id":"synthetic_concentrated","capture_timestamp":"2026-07-03T00:00:00Z","cash":500,"total_equity":10000,"margin_used":0,"borrowed_amount":0,"maintenance_margin_requirement":0.25,"initial_margin_requirement":0.5,"portfolio_source":"local_json","verification_status":"user_verified","positions":[{"ticker":"SYNTH","shares":95,"current_price":100,"market_value":9500,"position_weight":0.95,"user_intent":"hold","max_position_cap":0.5,"notes":"Synthetic concentration"}]}
