{"contract_version":"nhi.portfolio_snapshot.v1","snapshot_id":"synthetic_margin_danger","capture_timestamp":"2026-07-03T00:00:00Z","cash":100,"total_equity":3000,"margin_used":7000,"borrowed_amount":7000,"maintenance_margin_requirement":0.35,"initial_margin_requirement":0.5,"portfolio_source":"manual","verification_status":"user_verified","positions":[{"ticker":"SYNTH","shares":100,"current_price":100,"market_value":10000,"position_weight":1.0,"margin_requirement":0.35,"user_intent":"trim","notes":"Synthetic margin stress"}]}
