{"contract_version":"nhi.portfolio_snapshot.v1","snapshot_id":"synthetic_cash_add","capture_timestamp":"2026-07-03T00:00:00Z","cash":6000,"total_equity":10000,"margin_used":0,"borrowed_amount":0,"maintenance_margin_requirement":0.25,"initial_margin_requirement":0.5,"portfolio_source":"manual","verification_status":"user_verified","positions":[{"ticker":"SYNTH","shares":40,"current_price":100,"market_value":4000,"position_weight":0.4,"user_intent":"add","max_position_cap":0.6,"notes":"Synthetic available cash"}]}
